{
  "$schema": "https://json-schema.org/draft/2020-12/schema",
  "$id": "https://schemas.capsem.dev/capsem.profile.v2.schema.json",
  "title": "Capsem Profile Payload v2",
  "type": "object",
  "additionalProperties": false,
  "required": [
    "schema",
    "version",
    "id",
    "revision",
    "name",
    "description",
    "best_for",
    "profile_type",
    "ui",
    "compatibility",
    "vm",
    "packages",
    "tools",
    "security"
  ],
  "properties": {
    "schema": { "const": "capsem.profile.v2" },
    "version": { "const": 2 },
    "id": { "$ref": "#/$defs/profile_id" },
    "revision": { "$ref": "#/$defs/revision" },
    "name": { "$ref": "#/$defs/non_empty_string" },
    "description": { "$ref": "#/$defs/non_empty_string" },
    "best_for": { "$ref": "#/$defs/non_empty_string" },
    "profile_type": { "enum": ["everyday-work", "coding"] },
    "ui": { "enum": ["everyday", "coding"] },
    "icon_svg": {
      "type": "string",
      "pattern": "^\\s*<svg[\\s>]"
    },
    "extends_profile_id": { "$ref": "#/$defs/profile_id" },
    "extends_profile_revision": { "$ref": "#/$defs/revision" },
    "compatibility": { "$ref": "#/$defs/compatibility" },
    "general": { "$ref": "#/$defs/general" },
    "appearance": { "$ref": "#/$defs/appearance" },
    "ai": { "$ref": "#/$defs/ai" },
    "mcpServers": { "$ref": "#/$defs/mcp_servers" },
    "skills": { "$ref": "#/$defs/skills" },
    "vm": { "$ref": "#/$defs/vm" },
    "packages": { "$ref": "#/$defs/packages" },
    "tools": { "$ref": "#/$defs/tools" },
    "security": { "$ref": "#/$defs/security" }
  },
  "dependentRequired": {
    "extends_profile_id": ["extends_profile_revision"],
    "extends_profile_revision": ["extends_profile_id"]
  },
  "$defs": {
    "non_empty_string": {
      "type": "string",
      "minLength": 1
    },
    "profile_id": {
      "type": "string",
      "pattern": "^[a-z0-9][a-z0-9-]{2,63}$"
    },
    "config_id": {
      "type": "string",
      "pattern": "^[A-Za-z0-9_.-]+$"
    },
    "rule_name": {
      "type": "string",
      "pattern": "^[A-Za-z0-9_-]+$"
    },
    "revision": {
      "type": "string",
      "pattern": "^[0-9]{4}\\.[0-9]{4}\\.[0-9]+$"
    },
    "hash": {
      "type": "string",
      "pattern": "^blake3:[0-9a-f]{64}$"
    },
    "uri": {
      "type": "string",
      "format": "uri"
    },
    "version_string": {
      "type": "string",
      "minLength": 1
    },
    "compatibility": {
      "type": "object",
      "additionalProperties": false,
      "required": ["min_binary", "guest_abi"],
      "properties": {
        "min_binary": { "$ref": "#/$defs/version_string" },
        "max_binary": { "type": "string" },
        "guest_abi": {
          "type": "string",
          "pattern": "^capsem-guest-v[0-9]+$"
        }
      }
    },
    "general": {
      "type": "object",
      "additionalProperties": false,
      "properties": {
        "display_name": { "$ref": "#/$defs/non_empty_string" }
      }
    },
    "appearance": {
      "type": "object",
      "additionalProperties": false,
      "properties": {
        "theme": { "enum": ["inherit-service", "system", "light", "dark"] },
        "accent": {
          "type": "string",
          "pattern": "^#[0-9a-fA-F]{6}$"
        }
      }
    },
    "ai": {
      "type": "object",
      "additionalProperties": false,
      "properties": {
        "providers": {
          "type": "object",
          "additionalProperties": false,
          "patternProperties": {
            "^[A-Za-z0-9_.-]+$": { "$ref": "#/$defs/ai_provider" }
          }
        }
      }
    },
    "ai_provider": {
      "type": "object",
      "additionalProperties": false,
      "properties": {
        "enabled": { "type": "boolean" },
        "model": { "$ref": "#/$defs/non_empty_string" },
        "base_url": { "$ref": "#/$defs/uri" },
        "credential_refs": {
          "type": "array",
          "items": { "$ref": "#/$defs/config_id" },
          "uniqueItems": true
        },
        "rules": { "$ref": "#/$defs/security_rules" }
      }
    },
    "mcp_servers": {
      "type": "object",
      "additionalProperties": false,
      "patternProperties": {
        "^[A-Za-z0-9_.-]+$": { "$ref": "#/$defs/mcp_server" }
      }
    },
    "mcp_server": {
      "type": "object",
      "additionalProperties": false,
      "properties": {
        "enabled": { "type": "boolean" },
        "type": { "enum": ["stdio", "http", "sse"] },
        "command": { "$ref": "#/$defs/non_empty_string" },
        "args": {
          "type": "array",
          "items": { "$ref": "#/$defs/non_empty_string" }
        },
        "env": {
          "type": "object",
          "propertyNames": { "$ref": "#/$defs/non_empty_string" },
          "additionalProperties": { "type": "string" }
        },
        "url": { "$ref": "#/$defs/uri" },
        "headers": {
          "type": "object",
          "propertyNames": { "$ref": "#/$defs/non_empty_string" },
          "additionalProperties": { "type": "string" }
        },
        "bearerToken": { "type": "string" },
        "pool_size": {
          "type": "integer",
          "minimum": 1
        },
        "pool_safe_tools": {
          "type": "array",
          "items": { "$ref": "#/$defs/non_empty_string" },
          "uniqueItems": true
        },
        "capsem": { "$ref": "#/$defs/mcp_server_capsem" }
      },
      "oneOf": [
        {
          "required": ["command"],
          "not": { "required": ["url"] }
        },
        {
          "required": ["url"],
          "not": { "required": ["command"] }
        }
      ],
      "allOf": [
        {
          "if": {
            "properties": { "type": { "const": "stdio" } },
            "required": ["type"]
          },
          "then": { "required": ["command"] }
        },
        {
          "if": {
            "properties": { "type": { "enum": ["http", "sse"] } },
            "required": ["type"]
          },
          "then": { "required": ["url"] }
        }
      ]
    },
    "mcp_server_capsem": {
      "type": "object",
      "additionalProperties": false,
      "properties": {
        "credential_refs": {
          "type": "array",
          "items": { "$ref": "#/$defs/config_id" },
          "uniqueItems": true
        },
        "allowed_tools": {
          "type": "array",
          "items": { "$ref": "#/$defs/non_empty_string" },
          "uniqueItems": true
        },
        "rules": { "$ref": "#/$defs/security_rules" }
      }
    },
    "skills": {
      "type": "object",
      "additionalProperties": false,
      "properties": {
        "groups": {
          "type": "array",
          "items": { "$ref": "#/$defs/config_id" },
          "uniqueItems": true
        },
        "enabled": {
          "type": "array",
          "items": { "$ref": "#/$defs/config_id" },
          "uniqueItems": true
        },
        "disabled": {
          "type": "array",
          "items": { "$ref": "#/$defs/config_id" },
          "uniqueItems": true
        }
      }
    },
    "vm": {
      "type": "object",
      "additionalProperties": false,
      "required": ["memory_mib", "cpus", "disk_mib", "network", "assets"],
      "properties": {
        "memory_mib": { "type": "integer", "minimum": 512 },
        "cpus": { "type": "integer", "minimum": 1 },
        "disk_mib": { "type": "integer", "minimum": 1024 },
        "network": { "enum": ["proxied", "disabled", "direct"] },
        "track_rootfs_dependencies": { "type": "boolean" },
        "rootfs_image": { "$ref": "#/$defs/non_empty_string" },
        "assets": { "$ref": "#/$defs/assets_by_arch" }
      }
    },
    "assets_by_arch": {
      "type": "object",
      "additionalProperties": false,
      "minProperties": 1,
      "properties": {
        "arm64": { "$ref": "#/$defs/arch_assets" },
        "x86_64": { "$ref": "#/$defs/arch_assets" }
      }
    },
    "arch_assets": {
      "type": "object",
      "additionalProperties": false,
      "required": ["kernel", "initrd", "rootfs"],
      "properties": {
        "kernel": { "$ref": "#/$defs/asset" },
        "initrd": { "$ref": "#/$defs/asset" },
        "rootfs": { "$ref": "#/$defs/asset" }
      }
    },
    "asset": {
      "type": "object",
      "additionalProperties": false,
      "required": ["url", "hash", "signature_url", "size", "content_type"],
      "properties": {
        "url": { "$ref": "#/$defs/uri" },
        "hash": { "$ref": "#/$defs/hash" },
        "signature_url": { "$ref": "#/$defs/uri" },
        "size": { "type": "integer", "minimum": 1 },
        "content_type": { "$ref": "#/$defs/non_empty_string" }
      }
    },
    "packages": {
      "type": "object",
      "additionalProperties": false,
      "required": ["runtimes", "system"],
      "properties": {
        "runtimes": {
          "type": "object",
          "additionalProperties": false,
          "minProperties": 1,
          "patternProperties": {
            "^[A-Za-z0-9_.-]+$": { "$ref": "#/$defs/version_string" }
          }
        },
        "python_modules": {
          "type": "object",
          "additionalProperties": false,
          "patternProperties": {
            "^[A-Za-z0-9_.-]+$": { "$ref": "#/$defs/version_string" }
          }
        },
        "node_packages": {
          "type": "object",
          "additionalProperties": false,
          "patternProperties": {
            "^(@[A-Za-z0-9_.-]+/)?[A-Za-z0-9_.-]+$": {
              "$ref": "#/$defs/version_string"
            }
          }
        },
        "system": { "$ref": "#/$defs/system_packages" }
      }
    },
    "system_packages": {
      "type": "object",
      "additionalProperties": false,
      "required": ["distro", "release"],
      "properties": {
        "distro": { "enum": ["debian"] },
        "release": { "$ref": "#/$defs/non_empty_string" },
        "apt": {
          "type": "object",
          "additionalProperties": false,
          "patternProperties": {
            "^[A-Za-z0-9+_.-]+$": { "$ref": "#/$defs/version_string" }
          }
        }
      }
    },
    "tools": {
      "type": "object",
      "additionalProperties": false,
      "minProperties": 1,
      "patternProperties": {
        "^[A-Za-z0-9_.-]+$": { "$ref": "#/$defs/tool" }
      }
    },
    "tool": {
      "type": "object",
      "additionalProperties": false,
      "required": ["version", "required", "source"],
      "properties": {
        "version": { "$ref": "#/$defs/version_string" },
        "required": { "type": "boolean" },
        "source": { "enum": ["guest", "host", "profile"] }
      }
    },
    "security": {
      "type": "object",
      "additionalProperties": false,
      "properties": {
        "capabilities": { "$ref": "#/$defs/security_capabilities" },
        "rules": { "$ref": "#/$defs/security_rules" }
      }
    },
    "security_capabilities": {
      "type": "object",
      "additionalProperties": false,
      "properties": {
        "credential_brokerage": { "$ref": "#/$defs/capability_mode" },
        "pii_detection": { "$ref": "#/$defs/capability_mode" },
        "mcp_rag": { "$ref": "#/$defs/capability_mode" },
        "mcp_tools": { "$ref": "#/$defs/capability_mode" },
        "network_egress": { "$ref": "#/$defs/capability_mode" },
        "file_boundaries": { "$ref": "#/$defs/capability_mode" },
        "audit": { "$ref": "#/$defs/capability_mode" }
      }
    },
    "capability_mode": {
      "enum": ["allow", "ask", "block", "audit"]
    },
    "security_rules": {
      "type": "object",
      "additionalProperties": false,
      "properties": {
        "mcp": { "$ref": "#/$defs/rule_map" },
        "http": { "$ref": "#/$defs/rule_map" },
        "dns": { "$ref": "#/$defs/rule_map" },
        "model": { "$ref": "#/$defs/rule_map" },
        "hook": { "$ref": "#/$defs/rule_map" }
      }
    },
    "rule_map": {
      "type": "object",
      "additionalProperties": false,
      "patternProperties": {
        "^[A-Za-z0-9_-]+$": { "$ref": "#/$defs/rule" }
      }
    },
    "rule": {
      "type": "object",
      "additionalProperties": false,
      "required": ["on", "if", "decision"],
      "properties": {
        "on": {
          "enum": [
            "mcp.request",
            "mcp.response",
            "http.request",
            "http.response",
            "http.read",
            "http.write",
            "dns.request",
            "dns.response",
            "model.request",
            "model.response",
            "model.tool_call",
            "model.tool_response",
            "hook.decision"
          ]
        },
        "if": { "$ref": "#/$defs/non_empty_string" },
        "decision": { "enum": ["allow", "ask", "block", "rewrite"] },
        "priority": {
          "type": "integer",
          "minimum": -1000,
          "maximum": 999
        },
        "rewrite_target": { "$ref": "#/$defs/non_empty_string" },
        "rewrite_value": { "$ref": "#/$defs/non_empty_string" },
        "strip_request_headers": {
          "type": "array",
          "items": { "$ref": "#/$defs/non_empty_string" },
          "uniqueItems": true
        },
        "strip_response_headers": {
          "type": "array",
          "items": { "$ref": "#/$defs/non_empty_string" },
          "uniqueItems": true
        },
        "reason": { "$ref": "#/$defs/non_empty_string" }
      }
    }
  }
}
